{
  "$schema": "https://json-schema.org/draft/2020-12/schema",
  "$id": "https://internal/schema/evidence-ledger.schema.json",
  "title": "Evidence Ledger, so nguon nang cap cho bao cao tai chinh",
  "description": "Nang cap tu window.SRC/window.RPT kieu reference-kimi.html: SRC la so nguon (K1..K30, moi entry co cat/date/fact/cite) nhung KHONG co lien ket tuong minh toi tung con so trong RPT. Ledger nay tach hai lop: 'sources' (dang ky nguon, 1 nguon dung nhieu lan) va 'values' (moi con so hien thi, bat buoc tro ve dung 1 source_id).",
  "type": "object",
  "required": ["version", "generated_date", "sources", "values"],
  "additionalProperties": false,
  "properties": {
    "_doc": {
      "type": ["array", "string"],
      "description": "Ghi chu cho nguoi mo file ra doc, khong tham gia doi chieu. `_doc` la quy uoc dung o moi file JSON cua repo (xem charts/schema.vocab.json) nen schema phai cho phep, neu khong thi moi so nguon co ghi chu deu FAIL vi mot ly do khong lien quan gi toi bang chung."
    },
    "version": { "type": "string" },
    "generated_date": { "$ref": "#/$defs/loose_date" },
    "sources": {
      "type": "array",
      "minItems": 1,
      "items": { "$ref": "#/$defs/source" }
    },
    "values": {
      "type": "array",
      "minItems": 1,
      "items": { "$ref": "#/$defs/value" }
    }
  },
  "$defs": {
    "loose_date": {
      "type": "string",
      "description": "Cho phep YYYY, YYYY-MM, hoac YYYY-MM-DD (du lieu vi mo hay tro ve nam/thang, khong phai luc nao cung co ngay).",
      "pattern": "^[0-9]{4}(-[0-9]{2}(-[0-9]{2})?)?$"
    },
    "tier": {
      "type": "string",
      "enum": ["T1_official", "T2_audited", "T3_broker", "T4_internal_estimate", "T5_derived"],
      "description": "Thang bac do tin cay, GIAM DAN: T1 cong bo chinh thuc (co quan nha nuoc, luat/nghi dinh, to chuc da phuong WB/IMF/GSO) > T2 bao cao kiem toan (BCTC da kiem toan, cong bo doanh nghiep co xac nhan kiem toan) > T3 broker/nghien cuu thi truong (cong ty chung khoan, Mordor, McKinsey) > T4 uoc tinh noi bo (tu tinh tu du lieu that, co cong thuc kiem tra duoc) > T5 suy dien (derived/extrapolation, kieu pheu TAM-SAM-SOM)."
    },
    "sensitivity": {
      "type": "string",
      "enum": ["public", "internal_only"],
      "description": "public = duoc phep trich dan day du cho ban gui khach (so lieu da cong bo cong khai, vd World Bank/GSO/Nghi dinh da ky cong bao). internal_only = chi hien trong ban noi bo; ban gui di PHAI dung public_label thay the, khong duoc lo ten co quan/kenh tin/nguoi trong mang luoi."
    },
    "source": {
      "type": "object",
      "required": ["id", "org", "tier", "sensitivity", "published_date", "cite"],
      "additionalProperties": false,
      "properties": {
        "id": { "type": "string", "pattern": "^K[0-9]+$" },
        "org": { "type": "string", "description": "Ten to chuc phat hanh (World Bank, NHNN, Mordor Intelligence...). CHI dung khi sensitivity=public trong ban gui di; ban noi bo luon duoc xem." },
        "tier": { "$ref": "#/$defs/tier" },
        "sensitivity": { "$ref": "#/$defs/sensitivity" },
        "published_date": { "$ref": "#/$defs/loose_date" },
        "cite": { "type": "string", "description": "Trich dan day du: ten bao cao, ma so lieu, ky." },
        "url": { "type": "string", "format": "uri" },
        "public_label": {
          "type": "string",
          "description": "BAT BUOC neu sensitivity=internal_only. Cau thay the da duyet theo bang quy doi (memory feedback_no_source_disclosure_in_artifacts), dung nguyen van khi export ban external, khong duoc dien giai lai tuy hung."
        }
      },
      "allOf": [
        {
          "if": { "properties": { "sensitivity": { "const": "internal_only" } } },
          "then": { "required": ["public_label"] }
        }
      ]
    },
    "value": {
      "type": "object",
      "required": ["id", "value", "unit", "period", "source_id", "retrieved_date", "tier", "chart_id"],
      "additionalProperties": false,
      "properties": {
        "id": { "type": "string", "description": "ID duy nhat cua con so, dung de gan voi data-evid trong HTML." },
        "display": { "type": "string", "description": "Chuoi hien thi dung nhu trong HTML (vd '16,0 ty USD'), dung de doi chieu chong lech." },
        "value": { "type": "number" },
        "unit": { "type": "string", "description": "Don vi chuan hoa (vd 'ty USD', 'trieu USD', '%'). Phai giong het nhau trong cung mot chart_id." },
        "period": { "type": "string", "description": "Ky du lieu, vd '2024', '2025-Q1', '2015-2024'." },
        "source_id": { "type": "string", "pattern": "^K[0-9]+$", "description": "Phai khop dung 1 entry trong sources[]. Khong duoc mo coi." },
        "retrieved_date": { "$ref": "#/$defs/loose_date", "description": "Ngay lay so ve, khong duoc o tuong lai so voi ngay chay validator." },
        "tier": { "$ref": "#/$defs/tier", "description": "Ban sao co chu y cua source.tier; validator bat loi neu lech nhau (tranh nang cap/ha cap tier ngam khi ghi value)." },
        "chart_id": { "type": "string", "description": "Nhom bieu do/bang de kiem don vi nhat quan trong cung 1 nhom." },
        "note": { "type": "string" }
      }
    }
  }
}
